POSITIVE;NEGATIVE;NEUTRAL;COMPOUND;SENTENCE
0.0;0.0;1.0;0.0;Alcanza con mirar a la región alcanza con mirar lo que está pasando en Brasil donde se disolvió el Ministerio de Trabajo.
0.0;0.0;1.0;0.0;Alcanza con ver la Argentina de Macri que muchos acá aplaudían y que el año pasado en Jujuy legalizó el trabajo de los diez años a pedido de la industria tabacalera.
0.0;0.0;1.0;0.0;Para saber lo que está en riesgo más que nunca sobre todo apoyados en los movimientos sociales convocamos a construir una patria de trabajo una patria solidaria y una patria que profundice los derechos humanos y la democracia que también tiene que ver con que menos gurises vivan en situaciones de exclusión.
0.0;0.0;1.0;0.0;________________


Fueron en realidad.
0.126;0.126;0.747;0.0;la primera pregunta que me hago por qué todas esas cosas no se hicieron cuando.
0.0;0.0;1.0;0.0;Cuando fueron gobierno porque en realidad los partidos tradicionales tenían de empleados públicos un 21 por ciento sobre el total de la población económicamente activa.
0.0;0.0;1.0;0.0;Esa fue la realidad.
0.0;0.0;1.0;0.0;Y la realidad que cuando gestionaron las empresas públicas y la forma de gestionar las empresas públicas fue brutalmente clientelista.
0.0;0.0;1.0;0.0;O sea el Uruguay que yo conocí cuando había campaña electoral y se abrió un club.
0.0;0.0;1.0;0.0;La primera pregunta que había que hacerse es si quien había abierto ese club le iban a poner el teléfono le iban a sacar la jubilación si quien había ese club entraba al Estado él o sus familiares y eso que uno pudo decir eso era antes.
0.0;0.0;1.0;0.0;Bueno es ahora la mayoría de los ingresos habidos en el Estado son en las intendencias donde gobierna la oposición.
0.0;0.0;1.0;0.0;________________
Yo empecé a militar en el año 87.
0.0;0.0;1.0;0.0;Hacía.
0.0;0.157;0.843;-0.3818;pocos meses en diciembre del 86 que aparte de haber echado a Germán Araújo en Senado.
0.0;0.0;1.0;0.0;se había votado la Ley de Caducidad.
0.0;0.0;1.0;0.0;Empecé a militar en la Federación de Estudiantes del Interior.
0.0;0.0;1.0;0.0;y. del 87 acá.
0.0;0.0;1.0;0.0;Cada vez que hubo que discutir acerca del incremento de la inversión educativa.
0.252;0.0;0.748;0.4019;Siempre estuve a favor del incremento de la inversión educativa.
0.0;0.0;1.0;0.0;Me van a encontrar siempre porque en definitiva.
0.0;0.0;1.0;0.0;la confianza en las propuestas es integraste un proceso político social que empujó cada vez que pudo para decir la educación tiene que ser principal un derecho principal.
0.0;0.0;1.0;0.0;Yo creo que precisamos educación en primer lugar para las personas en situación de discapacidad.
0.0;0.0;1.0;0.0;En segundo lugar pensar educación artística que complemente y nos ayude a construir una sociedad menos violenta.
0.0;0.0;1.0;0.0;En tercer lugar los estudiantes de secundaria más vulnerado para que puedan completar transición educativa como pasa en la experiencia que estamos instalando en Inefop que un 90 por ciento sigue estudiando.
0.0;0.0;1.0;0.0;________________
Bueno en primer lugar agradecer al economista Talvi que haya aceptado la posibilidad de este debate de cara a las internas ojalá.
0.0;0.423;0.577;-0.296;No sea el único.
0.0;0.0;1.0;0.0;Le hace bien a la democracia que se pueda intercambiar sobre la base ideas planteó diferentes del punto de vista del papel del Estado de la economía enfoques balances y que se pueda hacer de manera de manera civilizada y con respeto.
0.0;0.141;0.859;-0.8957;Creo que su mérito es algo que nos convocaban las juventudes de todos los partidos políticos cuando en el aniversario del río de libertad pedían por una campaña sin enchastre por una campaña sin descalificación por una campaña sin provocaciones y ojalá tengamos hasta el último domingo de octubre que el debate sea de esta manera sea sobre la base de ideas y pudiendo darnos la mano al final del debate.
0.0;0.0;1.0;0.0;En segundo lugar.
0.0;0.0;1.0;0.0;agradecer a los frenteamplistas hemos me emocionaba recién las imágenes de la cantidad de compañeros y compañeras que en todo el país se organizaron para ver juntos.
0.0;0.0;1.0;0.0;para ver juntos esta discusión.
0.0;0.0;1.0;0.0;Agradecer a los demás precandidatos y la precandidata que dijeron sentirse representado.
0.237;0.0;0.763;0.4215;Creo que el campo popular sabe que para poder transformar.
0.0;0.0;1.0;0.0;se necesita de mucha unidad se necesita de mucha fraternidad para poder sembrar esperanza.
0.0;0.155;0.845;-0.296;Yo capaz que soy de los precandidatos el que no debiera estar acá.
0.0;0.423;0.577;-0.296;porque no tengo abolengo.
0.0;0.0;1.0;0.0;soy trabajador de la construcción.
0.0;0.071;0.929;-0.296;No hay experiencias en toda América Latina de un trabajador de la construcción que pueda acceder a la vicepresidencia de la Presidencia de República que vengo de un barrio muy humilde.
0.0;0.0;1.0;0.0;Recién a los 15 años conocí el agua potable.
0.0;0.035;0.965;-0.296;pero me hizo aprender de que en el barrio nos teníamos que organizar para que las vecinas que tenían más dificultad se les pudiera acarrear desde el aljibe que en el barrio había que organizarse para juntos promover que el merendero le dejara algo a los gurises que no tenían nada en la cena o juntos había que organizarse para repartir suero oral.
0.0;0.0;1.0;0.0;para lograr que ningún Gurí del barrio muriera deshidratado.
0.0;0.0;1.0;0.0;En la construcción después aprendí.
0.0;0.0;1.0;0.0;que cuando un trabajador llega a cascote de mucho tiempo de pasar mal esa semana entra en la olla de manera gratuita y entre los demás se le presta para el boleto.
0.0;0.0;1.0;0.0;El Uruguay que se viene tiene que ser un Uruguay que profundice las relaciones humanas que profundice las relaciones de solidaridad que profundice los espacios de encuentro.
0.0;0.0;1.0;0.0;Estamos en un momento difícil para la región y difícil para el Uruguay.
0.0;0.0;1.0;0.0;más que nunca hay que buscar caminos que permitan pensar juntos que permitan construir puentes y que permitan avanzar con una línea central esa que nos legaron Artigas que los más infelices estén primero que los más infelices sean los más privilegiados.
0.0;0.0;1.0;0.0;A eso convocamos el último domingo de octubre a votar contra las desigualdades.
0.0;0.306;0.694;-0.296;No newline at end of file
